"Status","Start Time","Stop Time","Duration in ms","Parent Suite","Suite","Sub Suite","Test Class","Test Method","Name","Description"
"passed","Sun Jun 21 17:27:23 UTC 2026","Sun Jun 21 17:27:24 UTC 2026","389","chromium","api/login.api.spec.ts","Login API (/authenticate)","","","invalid credentials land on /login with error flash message",""
"passed","Sun Jun 21 17:27:23 UTC 2026","Sun Jun 21 17:27:23 UTC 2026","387","chromium","api/login.api.spec.ts","Login API (/authenticate)","","","valid credentials land on /secure with success flash message",""
"passed","Sun Jun 21 17:27:25 UTC 2026","Sun Jun 21 17:27:26 UTC 2026","1388","chromium","login.spec.ts","","","","shows an error with invalid credentials",""
"passed","Sun Jun 21 17:27:24 UTC 2026","Sun Jun 21 17:27:25 UTC 2026","1361","chromium","login.spec.ts","","","","logs in successfully with valid credentials",""
"passed","Sun Jun 21 17:27:23 UTC 2026","Sun Jun 21 17:27:23 UTC 2026","89","chromium","api/login.api.spec.ts","Login API (/authenticate)","","","invalid credentials redirect to /login",""
"passed","Sun Jun 21 17:27:20 UTC 2026","Sun Jun 21 17:27:22 UTC 2026","1952","chromium","accessibility/login.a11y.spec.ts","login flow accessibility","","","secure page has no new accessibility violations (axe-core)",""
"passed","Sun Jun 21 17:27:22 UTC 2026","Sun Jun 21 17:27:23 UTC 2026","342","chromium","api/login.api.spec.ts","Login API (/authenticate)","","","valid credentials redirect to /secure",""
"passed","Sun Jun 21 17:27:10 UTC 2026","Sun Jun 21 17:27:20 UTC 2026","10256","chromium","accessibility/login.a11y.spec.ts","login flow accessibility","","","login page meets accessibility threshold (Lighthouse)",""
