"Status","Start Time","Stop Time","Duration in ms","Parent Suite","Suite","Sub Suite","Test Class","Test Method","Name","Description"
"passed","Sun Jun 21 18:44:31 UTC 2026","Sun Jun 21 18:44:31 UTC 2026","104","chromium","api/login.api.spec.ts","Login API (/authenticate)","","","invalid credentials redirect to /login",""
"passed","Sun Jun 21 18:44:33 UTC 2026","Sun Jun 21 18:44:34 UTC 2026","1298","chromium","login.spec.ts","","","","shows an error with invalid credentials",""
"passed","Sun Jun 21 18:44:31 UTC 2026","Sun Jun 21 18:44:32 UTC 2026","371","chromium","api/login.api.spec.ts","Login API (/authenticate)","","","invalid credentials land on /login with error flash message",""
"passed","Sun Jun 21 18:44:19 UTC 2026","Sun Jun 21 18:44:28 UTC 2026","9002","chromium","accessibility/login.a11y.spec.ts","login flow accessibility","","","login page meets accessibility threshold (Lighthouse)",""
"passed","Sun Jun 21 18:44:32 UTC 2026","Sun Jun 21 18:44:33 UTC 2026","1309","chromium","login.spec.ts","","","","logs in successfully with valid credentials",""
"passed","Sun Jun 21 18:44:28 UTC 2026","Sun Jun 21 18:44:30 UTC 2026","1871","chromium","accessibility/login.a11y.spec.ts","login flow accessibility","","","secure page has no new accessibility violations (axe-core)",""
"passed","Sun Jun 21 18:44:30 UTC 2026","Sun Jun 21 18:44:31 UTC 2026","342","chromium","api/login.api.spec.ts","Login API (/authenticate)","","","valid credentials redirect to /secure",""
"passed","Sun Jun 21 18:44:31 UTC 2026","Sun Jun 21 18:44:31 UTC 2026","398","chromium","api/login.api.spec.ts","Login API (/authenticate)","","","valid credentials land on /secure with success flash message",""
